id,name,text,trans
0000000000000,{user},篠澤広の『神格』を上げる方法。\n狙って奇跡を起こす方法は――,想要提升筱泽广『神格』、\n能顺利引发奇迹的方法——
0000000000000,{user},我々が共に、\n窮地へと飛び込むことです！,就是我们一起、\n投身于绝境之中！
0000000000000,広,ふふ……ふふふ……プロデューサー。\n今日、いま、ここで。,呵呵……呵呵呵……制作人。\n今天、此时此地。
0000000000000,広,わたしたちが、一緒に窮地に\n飛び込むって……なに？,要一起投身绝境……\n该怎么做？
0000000000000,{user},広さんのことですから、\nもうわかっているのでは？,聪明如你，\n应该猜得到吧？
0000000000000,広,まだわからない。予感だけがある。,还没。只是我有种预感。
0000000000000,広,きっと、いまだかつてない……\nきちくの所業なんだろうなって。,我猜一定是……\n前所未有的……魔鬼行径。
0000000000000,{user},フェスのセットリストを見てください。,请看音乐节的节目单。
0000000000000,広,最後、owl先輩がもう1曲歌う、ね。,最后、owl学姐还要再唱一首歌、呢。
0000000000000,{user},そのひとつ前、シークレットゲストが\nいるでしょう？,在那之前、不是有一位\n神秘嘉宾吗？
0000000000000,広,もうわかった。,我理解了一切。
0000000000000,{user},篠澤広がライブをします。\nこれから、ここで。,我要你上台演出。\n此时此地。
0000000000000,広,はつみみ……,初次耳闻……
0000000000000,広,ふふ、ちょっとキレそう……,呵呵、有点火大……
0000000000000,{user},よかったですね。\nowl先輩の直前ですよ。,多好的机会啊。\n能让owl学姐见识见识。
0000000000000,広,まったくよくない……話すだけで、\nわたしがどれだけ緊張したか……,一点都不好……光是跟她说话、\n我都快紧张死了……
0000000000000,{user},ライブ前のMCも頼んでおきましたよ。\nドンとハードルが上がるようなやつを。,演出前的CM我也安排好了。\n保证让难度再上一层楼。
0000000000000,広,お……っふ……,哦……呼……
0000000000000,{user},さあ、これで絶対に失敗できませんね。,好了，这下可不能失败咯。
0000000000000,広,ぐううううううう………………,咕呜呜呜呜呜呜………………
0000000000000,広,プロデューサーは……どえす。きちく。\nわたしをいじめて楽しんでる。,制作人你……抖S。鬼畜。\n以欺负我为乐。
0000000000000,{user},人聞きが悪い……共通の趣味でしょう？\nそれに……あの日、理解しましたから。,真不中听啊……这不是你情我愿吗？\n再说……我早就看清你了。
0000000000000,{user},窮地に追い込まれるほどに実力を\n増すのが、篠澤広なのだ、と。,筱泽广这个偶像、\n越是被逼入绝境，实力就会越强。
0000000000000,広,ふふ……今日は……\nわたしが無茶ぶりをされる番。,呵呵……今天……\n轮到我回应无理要求了。
0000000000000,広,ねぇ、プロデューサー。\nここで失敗したら……,制作人。\n要是这次我失败了……
0000000000000,広,いままでふたりで積み上げてきた\nものが、台無しになっちゃう、ね。,我们迄今为止积累的一切\n就全都白费了对吧。
0000000000000,広,たくさんの人に迷惑がかかって、\nファンをがっかりさせて……,会给很多人添麻烦、\n会让粉丝们失望……
0000000000000,広,せっかく『N.I.A』で優勝したのに、\nわたしたちの評判は地に落ちる。,连拼命在『N.I.A』拿下的冠军名号、\n也会一落千丈。
0000000000000,{user},元に戻るだけですよ。,大不了就是回到原点而已。
0000000000000,広,うん……だけど、それは……嫌だな。,嗯……但是、那样……我不要。
0000000000000,広,ライブ、ぜったい、成功させないと。,这场演唱会、绝对、要成功才行。
0000000000000,{user},あなたにしては良い気迫です。では……,决心可嘉。那么……
0000000000000,{user},ここで証明してください。\n十王星南を倒しうる神格を得た、と。,今天就证明给我看吧——\n你已经拥有了足以击败十王星南的神格。
0000000000000,{user},できるでしょう？\n俺の担当アイドルなら。,做得到吧？\n我的担当偶像。
0000000000000,広,ふ……ふふ。もちろん……\n……で、でき……る、よ。,呵……呵呵。当然……\n我……我做……得到……哦。
0000000000000,{user},よろしい。\n失望させないでくださいね、広さん。,很好。\n请不要让我失望、广同学。
0000000000000,広,はぁ……こんなにプレッシャーを\n感じたのは、はじめて。,哈啊……第一次……\n感受到这么大的压力。
0000000000000,広,まかせて。死ぬ気で、いってくる。,交给我吧。我要拼命了，去去就回。
0000000000000,広,ただいま、プロデューサー。,我回来了、制作人。
0000000000000,{user},おかえりなさい、広さん。,欢迎回来、广同学。
0000000000000,広,どう？　大ピンチ、乗り切った、よ。,怎么样？再大的危机我都挺过来了、哦。
0000000000000,広,わたしが星南に勝つ可能性。\n1パーセント、超えた？,现在我战胜星南的可能性，\n有没有超过1%？
0000000000000,{user},とんでもない。いまのライブが\nできるなら、もっと、もっと――,何止。要是能发挥出刚才演出的水准、\n恐怕胜算会更高、更高——
0000000000000,広,もしかして……\n1.2パーセントくらいいった？,难道说……\n已经到1.2%左右了？
0000000000000,{user},2パーセントはありますよ！,足足有2%了！
0000000000000,{user},ようやく……命を賭けられる程度の\n数字になりましたね。,总算……到了一个\n值得我们赌上性命的数字了呢。
0000000000000,広,おー……,哦—……
0000000000000,{user},月並みですが。本当に……\n素晴らしいライブでした。,想必你也听腻了……但真的\n是场无比出色的演出。
0000000000000,{user},あなたは、見事、\n十王星南を倒せるだけの神格を得た。,你成功取得了\n足以打倒十王星南的神格。
0000000000000,{user},owlをはじめとする、実力派アイドルが\n集うフェスで、実力を示した。,在这云集owl等实力派偶像的舞台上，\n你证明了自己的实力。
0000000000000,{user},これでまた、篠澤広に魅了された\nファンが大きく増える。,这样一来，就会有更多粉丝\n被筱泽广的魅力所吸引了。
0000000000000,広,プロデューサー……今度はわたしが、\n無茶ぶりをする番。,制作人……这次轮到我、\n来提无理要求咯。
0000000000000,広,『篠澤広』と『わたし』のズレを、\nどうするつもりなのか、教えて。,『筱泽广』和『自我』之间的偏差、\n你打算怎么处理呢。请告诉我。
0000000000000,広,いま、すぐ、ここで。,现在、马上、此时此刻。
0000000000000,広,（……困った顔、してくれる、かな？）,（……你会……对此犯难吗？）
0000000000000,{user},アイドルが陥る希望と適性のズレを、\nP科ではこう呼びます。,偶像期望与自身特质间的偏差、\n在制作人科、我们称之为——
0000000000000,{user},『アイドルのジレンマ』と。,『偶像困境』。
0000000000000,広,あれ……\nもしかして、解決できちゃう？,咦……\n难道说、有望解决了？
0000000000000,広,owl先輩は、信頼できる仲間と認め合う\nことで、ズレを許容していた。,owl学姐是通过加深和信赖的伙伴间\n彼此的认同，来缓和这种偏差的。
0000000000000,広,プロデューサーが……\nたくさん、たくさん、褒めてくれる？,制作人你……\n也会想方设法地夸我吗？
0000000000000,{user},そんなことはしませんよ。,那才不像我。
0000000000000,広,ぶー……じゃあどうするの？,姆——……那要怎么做？
0000000000000,{user},先ほど、おふたりの話を聞いて\nいましたが、owlさんは……,我听了你们刚才的谈话、\n那位owl小姐……
0000000000000,{user},詩と歌に強いこだわりがあるようです。\nそれらへの承認欲求も。そんな彼女が、,她似乎对诗歌有着很强的执着、\n而她渴望被认可的也是这一点。
0000000000000,{user},『アイドルのジレンマ』を物ともせず、\n現状に満足しているのは――,那么能够消解她的『偶像困境』，\n并让她满足于现状的——
0000000000000,広,素敵な仲間に認められているから……\n……だけじゃ、ない？　……あっ。,就是被优秀的伙伴们认同……\n……或许还、不止如此？……啊。
0000000000000,広,先輩のこだわりを褒めてくれる\nファンが、増え続けている、から？,因为有更多粉丝\n开始称赞她的这份执着了？
0000000000000,広,『変わり者』のファンが、仮に……\n全体の1割しかいなくても。,『品味独特的』粉丝们、就算……\n只占全体的一成。
0000000000000,広,ファンの総数を増やせば、\n『変わり者』の数は増えていく。,只要粉丝的总数增加、\n『怪人』的人数也会跟着增加。
0000000000000,広,もっとメジャーになる。\nこれが『アイドルのジレンマ』の解法。\n合ってる？,甚至变成真正的主流。\n这就是『偶像困境』的解法。\n对吗？
0000000000000,{user},緩和策その1です。すべての\nケースに適用できるわけではない。,只能说是权宜之计。\n并不适合所有情况。
0000000000000,広,わたしのケースには？,那对我来说呢？
0000000000000,{user},そもそも、あなたを『可愛い』と思って\nいるファンは、たくさんいますよ。,首先，认为你『可爱』的粉丝、\n本来就不在少数。
0000000000000,{user},美しすぎるがゆえに、可愛いという\n意見が目立たないだけです。,只不过是因为你美得太过耀眼、\n导致『可爱』这个评价反而不那么显眼了而已。
0000000000000,広,ほんとに？　わたし……みんなから、\nかわいいアイドルだって、思われてる？,真的吗？ 我在大家眼里……\n真的是个可爱的偶像吗？
0000000000000,{user},もちろん。疑うのなら、もっともっと\n可愛らしい曲も歌いましょう。,当然。要是不信，\n就多唱点可爱的歌吧。
0000000000000,{user},世界中が、女神のような篠澤広を、\n愛らしいと讃えるように。,直到全世界都发现女神·筱泽广\n惹人怜爱的一面。
0000000000000,広,………………もう。,………………讨厌。
0000000000000,広,そろそろ先輩のライブ、はじまるから。\n……手をつないで、一緒に観よ。,学姐的演唱会快开始了。\n……我们牵着手、一起看吧。
info,adv_dear_shro_026.txt,,
译者,病毒,,
