id,name,text,trans
0000000000000,咲季,帰ってきたわね――\n懐かしき我が家に！,终于回来啦——\n回到我怀念的老家！
0000000000000,燐羽,へぇ～、ここが咲季お姉ちゃんと佑芽が\n育った場所なんだ。,嘿～，这里就是咲季姐姐和佑芽\n长大的地方啊。
0000000000000,星南,雄大な自然。爽やかな空気……\n初星学園に劣らぬ威容の、\n花海トレーニングセンター。,广阔的自然。清爽的空气……\n这就是不逊于初星学园的宏伟建筑，\n花海训练中心。
0000000000000,星南,アイドル専用の最新育成施設……\n噂には聞いていたけれど……\n想像以上ね。,偶像专用的最新培育设施……\n虽然早有耳闻……\n但没想到会这么夸张。
0000000000000,咲季,プレオープン中だから、全施設を贅沢に\n使えるわ。特訓にはもってこいよ。,正好是在预开放期间，所有设施\n都可以尽情使用，正适合特训吧。
0000000000000,燐羽,しばらくお世話になります――\n咲季お姉ちゃん♡,接下来一段时间有多叨扰啦——\n咲季姐姐♡
0000000000000,咲季,ええ！　自分の家だと思って過ごして！,嗯！　把这儿当成自己家吧！
0000000000000,咲季,実はこの建物、わたしもはじめて\n入ったの。宿泊する部屋はたしか……,不过其实我也是第一次\n来这栋建筑呢。住宿的房间是在……
0000000000000,{user},案内しましょう。――こちらです。\nまずは荷物を部屋に置きましょうか。,我来带路吧。——这边请。\n我们先去房间放行李吧。
0000000000000,燐羽,なんでプロデューサーが、\nお姉ちゃんより内部に詳しいのよ……,为什么制作人\n会比姐姐还熟悉内部结构呢……
0000000000000,燐羽,さて。お父さんへの挨拶も終わったし、\nさっそくレッスンする？,好啦。跟爸爸打完招呼了，\n现在就开始训练吧？
0000000000000,咲季,やる気満々ね。\nでも、まずはミーティングからよ。\n最初の議題は――,干劲十足呢。\n不过得先开个会哦。\n第一个议题就是——
0000000000000,一同,佑芽のさらなる\n強化・育成プランについて！！,关于佑芽的进一步\n强化·培育方案！！
0000000000000,燐羽,言うと思った。はあ……\nプロデューサーまで声を揃えちゃって。,我就知道。唉……\n连制作人都跟你俩一个调调。
0000000000000,燐羽,佑芽に負けてリベンジしようってのに、\n同盟を組んでまず最初にすることが、,明明是因为输给佑芽而想要复仇，\n可结成同盟之后第一个要做的——
0000000000000,燐羽,佑芽をさらに強化する相談って――\n頭おかしいんじゃないの？,居然是商量怎么进一步强化佑芽——\n你们脑子是不是有问题啊？
0000000000000,咲季,なーんにもおかしくないわ。\nだってわたし、お姉ちゃんだもの！,才没问题啦。\n我可是姐姐啊！
0000000000000,星南,当然のことよ。私はあの子の、\nプロデューサーなのだから！,这是当然。\n我可是她的制作人啊！
0000000000000,{user},それが咲季さんの望みですから。,既然这是咲季所希望的。
0000000000000,燐羽,あっそ。好きにしなさい。\n――それで？,哦是嘛。随便吧。\n——然后呢？
0000000000000,燐羽,『<r\=プリマステラ>一番星</r>』になった佑芽を、\n次はどうプロデュースするつもり？,对于已经成为『启明星』的佑芽，\n接下来还要如何培育她？
0000000000000,星南,前提として、佑芽の急成長は、\n本人の努力と適性に加え、,首先，佑芽的急速成长，\n不光要归功于她自身的努力和天赋，
0000000000000,星南,周囲の環境との相乗効果によるものよ。\n特に咲季のサポートは強力だった。,还得益于周遭的天时地利人和。\n特别是咲季的支援格外有效。
0000000000000,咲季,あなたのプロデュースもね。,当然，还有你的培育。
0000000000000,星南,フフ……あの子には、私みずから\n徹底的なマンツーマンレッスンを\n行ったの。,呵呵……我可是亲自上阵，\n对她进行了彻底的\n一对一指导喔。
0000000000000,星南,名付けてプロジェクト『<r\=スーパーノヴァ>超新星</r>』！！,我将其命名为『超新星』计划！！
0000000000000,星南,その結果は、御存知の通りよ。,其结果，正如你所见。
0000000000000,咲季,十王星南直伝の\n『ENDLESS DANCE』。\n素晴らしかったわ。だけど、,十王星南亲传的\n『ENDLESS DANCE』。\n果然名不虚传。但是，
0000000000000,咲季,佑芽が冬の『H.I.F』で、\nリベンジャーと化した\nわたしたちと戦うのなら、,如果佑芽要在\n冬季的『H.I.F』中，\n迎接我们的复仇战——
0000000000000,星南,やはり新曲が必要かしら？　十王星南\nから継承した楽曲ではなくて――,果然还是需要新曲吧？不能是\n继承自十王星南的歌曲——
0000000000000,咲季,『花海佑芽の楽曲』が必要ね！,而是『花海佑芽的歌曲』才行呢！
0000000000000,星南,同感。最強の楽曲を用意しましょう。\n協力して頂戴、咲季。,同意。一起来准备最强的歌曲吧。\n来帮我，咲季。
0000000000000,咲季,よろこんで！　プロデューサーは、\n他に良い考えがあるかしら？,乐意之至！制作人，\n你还有其他好主意吗？
0000000000000,{user},彼女は自分以外のアイドルを観察して、\nよく学び、本質をつかむ方。,她很善于观察身边的其他偶像，\n勤加学习，并能抓住其本质。
0000000000000,{user},十王星南だけでなく、多くの実力者と\n引き合わせるべきでしょう。,不能只让她接触十王星南，\n也要推进她和更多实力者交流。
0000000000000,星南,適切な方針ね。歌詞も振り付けも\n覚えが悪いし、上達がはじまるまでに\n長い時間がかかるけれど。,很合理呢。\n虽然她记歌词和舞步很慢，\n到正式上道也要相当长的时间。
0000000000000,咲季,いったん伸びはじめたら、すごいのよ。\nどんどんどんどん追いついてきて――,但一旦开始成长，就速度惊人。\n她会不断地、一刻不停地追赶上来——
0000000000000,星南,いずれ、本家を超えてしまう。\nあぁ怖い。――ぜひやりましょう！,最终，甚至会超越效仿的本人。\n啊啊，真可怕。——就按这个方向来吧！
0000000000000,咲季,わたしたちと同じ恐怖を、\nプロアイドルの皆さんにも\n味わっていただきましょう！,就把我们\n一直体会的恐惧，\n给专业的偶像们品尝下吧！
0000000000000,燐羽,……息ぴったり。,……真是默契。
0000000000000,咲季,さて、最重要事項は話せたから。\n次の議題はわたしたちね。,那么，最重要的已经商量完了。\n下一个议题就是我们自己了。
0000000000000,燐羽,咲季お姉ちゃんには、\n事前に頼まれていた通り、\nボーカルレッスンをしてあげる。,我会按当初说好的来，\n帮咲季姐姐\n做歌唱训练。
0000000000000,星南,あら、私にはしてくれないの？,哎呀，不给我训练吗？
0000000000000,燐羽,してあげてもいいけど……\n意外な申し出ね。後輩相手に。,给你训练也不是不行……\n不过你对后辈倒是不耻下问呢。
0000000000000,星南,いまさら失うものなんてないもの。\nできることならなんでもやるわ。,事到如今，我已经没什么可失去的了。\n只要有用，任何方式我都不会放过。
0000000000000,燐羽,――――そ。\nなら、なんだってしてあげる。,————这样啊。\n那么，我也就不客气咯。
0000000000000,燐羽,代わりにあなたも、\n私たちに指導して。,作为回报，你也来\n指导我们吧。
0000000000000,星南,あなたにも？,你也需要吗？
0000000000000,燐羽,やり残したことをするために……\nアイドルに戻らなくちゃいけないの。,为了弥补曾经的遗憾……\n我必须重新成为偶像。
0000000000000,咲季,わたしからもお願い。\n十王星南の直接指導、\n効果は思い知っているもの。,我也要拜托你。\n毕竟这次我可是领教到了\n十王星南亲自指导的威力呢。
0000000000000,星南,お願いは不要よ。全員が全員を\n利用し合いましょう。,拜托就不必了。就让我们\n互相利用彼此吧。
0000000000000,星南,それこそがプロジェクト『<r\=スターダスト>星屑</r>』。,这正是『星屑』计划的真谛。
0000000000000,咲季,合宿が始まって、数日が経ったけど。\n成果はどう？,合宿开始已经过去几天了。\n成果如何？
0000000000000,星南,最新のトレーニングマシン、\nダンスの動作解析、効率的な食事……,最新的训练设备、\n舞蹈动作的解析、高效的饮食……
0000000000000,星南,科学的アプローチによって、どこまでも\nアイドルの<r\=ステータス>数値</r>を向上させていく――,通过科学方法，将偶像的数值\n无限提升——
0000000000000,星南,この施設の趣旨を\n早くも実感しているわ。,我已经深切体会到\n这个设施的宗旨了。
0000000000000,星南,まさか……私にまだ成長の余地が\n残っていたなんて、ね。,真没想到……我居然还有\n成长的空间呢。
0000000000000,星南,本当にありがとう、咲季！\nここに来てよかったわ！,真的太感谢你了，咲季！\n能来这里真好！
0000000000000,咲季,お礼なんて不要よ。同盟者でしょう？\nそれに……わたしだって、,道谢就免啦。我们是同盟者吧？\n而且……我也一样，
0000000000000,咲季,あなたと燐羽のおかげで、とっても\n有益な特訓ができているもの。,多亏了你和燐羽，\n才能有这么显著的训练效果。
0000000000000,燐羽,ふふ……咲季お姉ちゃんって、\nすごく飲み込み早いわね。美鈴並み。,呵呵……咲季姐姐的领悟速度真快。\n简直像美铃似的。
0000000000000,星南,スポンジのように吸収していくから、\n教えていて楽しいわ。,像海绵一样不断吸收知识，\n教起来也很享受呢。
0000000000000,咲季,新しいことを覚えるのは得意なの。\nただ――,我的确很擅长学习新事物啦。\n只不过——
0000000000000,星南,――咲季。そうやって使える手札を\n増やせるのが、あなたの才能。,——咲季。能够如此不断增加可用手段，\n这就是你的才能。
0000000000000,星南,よく考えて、有効に使いなさい。\nきっと強い武器になる。,好好思考，有效运用它们吧。\n这一定会成为你强大的武器。
0000000000000,咲季,………………ふふっ。,………………呵呵。
0000000000000,星南,な、なにかしら？,怎、怎么了吗？
0000000000000,咲季,佑芽<em>も</em>、素敵なプロデューサーに\n恵まれたのね。,佑芽也真幸运，\n遇到了一位这么优秀的制作人。
0000000000000,星南,……あなたほどじゃないわ。,……还比不上你啦。
0000000000000,星南,コホン――さて！　\nここまでの総括よ！,咳哼——好了！\n现在开始总结！
0000000000000,星南,この合宿で、私たちの<r\=ステータス>数値</r>は順調に\n上昇しているわ。これは大きな成果。,在这次集训中，我们的数值\n都顺利得到了提升。这无疑是显著的成果。
0000000000000,星南,けれど――……,但是——……
0000000000000,燐羽,こんなものじゃ足りないわね。,光这样还不够呢。
0000000000000,咲季,そうよ。いまこの瞬間も、あの子は\n成長を続けているんだもの。,是啊。因为此时此刻，\n她也在不断成长着。
0000000000000,咲季,わたしたちが、育てるんだもの！　\n最高の『<r\=プリマステラ>一番星</r>』に！,我们正在培育的，\n可是最棒的『启明星』啊！
0000000000000,星南,その上で勝つ。それには、\n数値を超える何かが必要。,即便如此也要赢。为此，\n我们需要能够超越数值的特性。
0000000000000,咲季,さあプロデューサー！　\nあなたの出番よ！,来吧制作人！\n轮到你了！
0000000000000,星南,私たちは、どうしたらいいのかしら？,我们该怎么做才好呢？
select,,挑戦あるのみ！,唯有挑战！
0000000000000,{user},『H.I.F<r\=セレクション>選抜試験</r>』が始まる前に、\n大きな成果を上げましょう！,在『H.I.F选拔考试』开始之前，\n让我们取得更出色的成果吧！
0000000000000,燐羽,レッスンをして、オーディションを\n受けて、ライブをする。,进行训练、参加试镜、\n举办演出。
0000000000000,燐羽,結局、アイドルがやるべきことって、\nそうなるわよね。,说到底，偶像该做的事情，\n也就是这些了吧。
0000000000000,星南,具体的なプランは？,具体的方案是？
0000000000000,{user},星南さんについては、\n言うまでもありません。,关于星南，\n自不必多说。
0000000000000,{user},やるべきことは、ご自身が\n一番よくわかっているはずです。,该做什么，你自己\n应该最清楚不过了。
0000000000000,星南,…………ええ。そう、ね。,…………嗯。是啊，没错。
0000000000000,{user},咲季さんは……,而咲季……
0000000000000,{user},――『VisuaL master』。\nこのオーディションに\n参加しましょう。,——『VisuaL master』。\n我们就参加\n这个试镜吧。
0000000000000,咲季,あの……プロデューサー？,那个……制作人？
0000000000000,咲季,参加者リストに、聞き覚えがある名前が\nずらっと並んでいるんだけど。,参赛者名单上，排着一长串\n很眼熟的名字呢。
0000000000000,{user},第一線で活躍するプロアイドルたちが\n参加するオーディションですから。,毕竟参加这场试镜的\n全都是活跃在第一线的职业偶像嘛。
0000000000000,{user},参加人数こそ違いますが、\n『N.I.A』の『QUARTET』に近い\n形式です。慣れたものでしょう？,虽然参赛人数不同，但形式接近\n『N.I.A』中的『QUARTET』试镜。\n这个就很熟悉了吧？
0000000000000,星南,規模と参加者のレベルが段違いよ。\n……3組の生徒までいるじゃない。,但规模和参赛者的水平都天差地别啊。\n……而且还有三班的学生参加。
0000000000000,咲季,このひとたちを相手にして、\n駆け出しアイドルのわたしに……\n勝ち抜けっていうの？,让初出茅庐的偶像\n和这些人竞争，\n……然后去获胜？
0000000000000,{user},はい。,是的。
select,,花海咲季なら勝ちます,花海咲季一定没问题
0000000000000,燐羽,このプロデューサー、こっわ……\n目が据わってる……,这制作人也太吓人了……\n眼神都直勾勾的……
0000000000000,咲季,わたし……ちっとも……\n立ち直ってなんていないんだからね。,其实我……一点也……\n没有振作起来哦。
0000000000000,咲季,自信なんて粉々で……あれからずっと、\nあなたに弱音ばかり……,自信心早就支离破碎了……从那之后，\n也一直在向你示弱……
0000000000000,{user},そうですね。いまのあなたは、\n無敵のアイドルではない。\n見栄を張る余裕すらない。,是啊。现在的你\n绝非无敌的偶像。\n甚至连逞强的余力都没有。
0000000000000,{user},想定していたブレイクスルーとは、\nほど遠い有様です。,这与我所预想的『不破不立』，\n实在是相去甚远。
0000000000000,咲季,ならっ――,那么——
0000000000000,{user},約束しました。プロデューサーの選択を\n正解にしてくれると。,但你答应过我。要用行动证明，\n我的选择是正确的。
0000000000000,咲季,……ずるいわ。,……太狡猾了。
0000000000000,咲季,そんなふうに言われたら……\nどんな無茶ぶりだって……,被你这么一说……\n就算再无理的要求……
0000000000000,咲季,応えるしか……ないじゃない……！　\n――けどね！,我也只能……答应了吧……！\n——不过呢！
0000000000000,咲季,覚悟しなさいプロデューサー！　\nオーディション当日までず～っと毎晩！,你也要做好觉悟，制作人！\n直到试镜那天为止，每晚都要！
0000000000000,咲季,わたしの弱音を\n受け止めてもらうんだから！,乖乖来倾听\n我的软弱吧！
info,adv_dear_hski_025.txt,,
译者,煉金術式,,
