id,name,text,trans
0000000000000,{user},藤田さん。『H.I.F』本戦への\n出場が決まりましたよ。,藤田同学。我们已经确定\n拿到『H.I.F』正赛的资格了。
0000000000000,ことね,おっし……おっし！　まずはおっけー。\nセェ～～～～～フ。,好耶……好耶！总之第一步是过关了。\n安～～～～～全。
0000000000000,{user},そんなに緊張していたんですか？,原来你这么紧张吗？
0000000000000,ことね,いやだって、あたし<r\=セレクション>選抜試験</r>\n受けてないですし……,因为、我连选拨考试\n都没参加过啊……
0000000000000,{user},定期公演と『N.I.A』で続けて結果を\n出したではないですか。,但你在定期公演和『N.I.A』上\n已经接连证明了自己、不是吗？
0000000000000,{user},これで選ばれないなんてことは、\nさすがにあり得ません。,要是这样的表现还落选，\n那才真是没天理了。
0000000000000,ことね,わかってはいるんですけどぉ～～～～！,道理我都懂啦～～～～！
0000000000000,ことね,これまで……そーゆー……なにかに\n選ばれるのとか、縁なかったんで。,只不过我这人……可能天生\n就跟‘中奖’这类词没什么缘分。
0000000000000,ことね,ネットでも、藤田ことねの優勝は\nまぐれ～とか……言われてますし。,而且网上还有人说，\n藤田琴音能夺冠纯粹是运气好～什么的……
0000000000000,ことね,せっかく選ばれた『H.I.F』で\nもしも活躍できなかったら……,难得入选了『H.I.F』，\n要是表现不好的话……
0000000000000,ことね,『N.I.A』に参加したアイドルたちに……\n応援してくれたファンたちに……,对参加『N.I.A』的偶像们……\n对支持我的粉丝们……
0000000000000,ことね,どんな顔して謝ればいいのか\nわかんないですし。,我都不知该用什么表情\n向他们道歉才好了。
0000000000000,{user},さすが藤田さんですね。この期に及んで\n自己評価を下げているとは……,不愧是藤田同学。都这种时候了\n还在贬低自己……
0000000000000,ことね,なんですか、その……しょーがない\nやつだナ～、みたいな優しい笑み。,干嘛啦……露出这种\n“真拿你没办法”的温柔笑容。
0000000000000,{user},いいですか、藤田さん。\nトップアイドルをくだし、,听好了，藤田同学。\n能够击败顶级偶像、
0000000000000,{user},『N.I.A』で優勝したあなたは、\n素晴らしいアイドルです。,并在『N.I.A』获得优胜的你，\n是一位非常了不起的偶像。
0000000000000,ことね,……はい。,……嗯。
0000000000000,{user},主観的に見て、\n世界一可愛いアイドルですし、,从我主观来看、\n你是当之无愧的世界第一可爱的偶像。
0000000000000,{user},客観的に見ても、全宇宙でトップ\nクラスなのは間違いない。,从客观角度来说、\n你也绝对是全宇宙顶级的水准。
0000000000000,ことね,……はぃぃ。,……知～道～啦。
0000000000000,ことね,もぉ、真顔でガンガン褒めまくるぅ……,真是的，居然一脸认真地拼命夸奖人家……
0000000000000,{user},準<r\=プリマステラ>『一番星』</r>、準『トップアイドル』。\nそれが藤田ことねの正当な評価です。,准『启明星』，准『顶级偶像』。\n这才是对藤田琴音最公正的评价。
0000000000000,{user},世論ではなくプロデューサーの言葉を\n信じてください。,不要去信网上的舆论，\n要相信你的制作人。
0000000000000,ことね,はいっ！！　信じまぁす♡,知道了——！！ 我相信你♡
0000000000000,{user},よろしい。その上で、言って\nおきましょう。現在あなたは――,很好。不过在此之上、\n我得先说清楚。现在的你——
0000000000000,{user},『H.I.F』の優勝候補ではありません。,并非『H.I.F』的夺冠热门。
0000000000000,ことね,もちろん承知の上でっす。,这个我当然知道。
0000000000000,ことね,この前は、あたしと星南先輩の\n頂上決戦だって言ってくれましたけど。,毕竟之前你还说，\n那是我和星南前辈的巅峰对决。
0000000000000,ことね,状況、変わりましたもん。,可现在情况不一样了。
0000000000000,ことね,十王星南が……伝説のアイドルたちを、\nババーンとド派手に薙ぎ払って、,十王星南可是……把那些传说级的偶像们、\n“啪啪——”地华丽横扫出局、
0000000000000,ことね,トップアイドルになりましたもんっ！,成为了真正的顶级偶像！
0000000000000,{user},正真正銘の頂上決戦。\nその意見はいまも変わりません……が。,那是货真价实的巅峰对决。\n我现在也保持这个观点……不过。
0000000000000,{user},優勝候補は、トップアイドル・十王星南\nただひとりです。,这次的夺冠热门，\n目前有且仅有顶级偶像·十王星南一人。
0000000000000,ことね,……ふふっ。,……哈哈。
0000000000000,{user},嬉しそうですね。先ほどまで\n自信がなさそうにしていたのに。,看起来你很开心呢。明明刚才\n还一副缺乏自信的样子。
0000000000000,ことね,や、どーなんですかね。,这个、该怎么说呢——
0000000000000,ことね,プロデューサーのべた褒めで、\n自己肯定感はばっちり上がって……,被制作人这样一顿猛夸，\n我的自我认同感当然直线暴涨啦……
0000000000000,ことね,だけど憧れに手が届いたなんて、\nそこまでは自信なくて。,但我也还没自信到，\n觉得自己已经能够到那个我所憧憬的她。
0000000000000,ことね,最高のライブができる予感があって。,不过我有预感，这次我可以献上一场最棒的演出。
0000000000000,ことね,『N.I.A』の優勝をまぐれだって\n言ったやつらを、,我有绝对的自信、能让那些说\n我拿冠军是侥幸的家伙们
0000000000000,ことね,全員あたしのトリコにしてやれるって、\nそーゆー自信はめちゃあって。,全都拜倒在\n我的魅力之下！
0000000000000,ことね,それでも星南先輩に勝つ自信なんて\n……やっぱないんですけども。,但要说能否赢过星南学姐……\n我果然还是没有把握啦。
0000000000000,{user},超自信があって、超自信がない。\n両方なんですね。,极度的自信和极度的不自信、\n两种矛盾的情绪在你身上并存着呢。
0000000000000,ことね,そーなんですよー。\n困っちゃいますよねー。やーでも。,就是这样～\n很让人伤脑筋对吧～不过啊。
0000000000000,ことね,この状況がしっくりくるってゆーか。\n望むところってゆーか。,该说这状况正合我意呢，\n还是说我正求之不得呢。
0000000000000,ことね,あたしがやりたかったのって、\nこれなんですよ。,我一直以来想做的、\n就是这个啊。
0000000000000,ことね,あたしが、憧れの<em\=>星南ちゃん</em>に、\n挑むんです。,向憧憬的小星南\n发起挑战。
0000000000000,ことね,アイドル活動に勝負を持ち込むのは、\n藤田ことねちゃんとしては……,把“胜负”带入偶像活动中，\n对藤田琴音来说……
0000000000000,ことね,違うんですけどね。……ちゃんと、\n直前になったら忘れるので。,其实是不对的啦。……等真到了上场前一刻，\n我就会把这些都忘掉的。
0000000000000,ことね,しっかりファンだけを見て、歌うので。,我会好好地、只为了粉丝们而歌唱。
0000000000000,ことね,本番がはじまるギリギリまでは……\nあのひとだけを見つめていたいんです。,但在正式开演前的最后一秒为止……\n我都只想注视着那个人。
0000000000000,{user},……『H.I.F』当日までの短い期間で、\nできることは少ない。,……在『H.I.F』到来前的短暂时间里，\n能做的事情实在有限。
0000000000000,{user},ベストコンディションで挑めるように\n――と、助言するつもりでしたが。,我本打算提醒你\n调整到最佳状态迎接挑战——
0000000000000,{user},まったく問題なさそうですね。,看来现在的你已经完全没问题了。
0000000000000,ことね,素敵なプロデューサーと、\nライバルのおかげです。,这都多亏了有位超棒的制作人\n和超棒的对手呀。
0000000000000,ことね,ただぁ……あたし、\nすっごく落ち込みやすいんでぇ……,只是啊……我这个人\n真的超级容易消沉啦……
0000000000000,ことね,毎日！　思いっきり！　\n甘やかしてほしいでぇ～～～っす♡,所以制作人，你每天！都要！\n狠狠地宠我才行喔～～～♡
info,adv_dear_fktn_023.txt,,
译者,夏色彼方,,
