id,name,text,trans
0000000000000,広,ふぅ……ふぅ……はっ…………ふ……,呼……呼……哈…………呼……
0000000000000,千奈,ハァ～ッ……ハァ～ッ……,哈啊～……哈啊～……
0000000000000,広,…………………………千奈、いきてる？,…………………………千奈、还活着吗？
0000000000000,千奈,……ハァ……フゥ……\nなぜか……生き延びておりますわ……,……哈啊……呼……\n不知为何……我还活着哇……
0000000000000,佑芽,ふぅ～～～～……\nこれは……きっついねぇ～～～～♪,呼～～～～……\n这个……可真够呛呢～～～～♪
0000000000000,千奈,まぁ……花海さんが……レッスンで\n苦しそうにしているなんて……,哎呀……花海同学……竟然会在训练中\n露出痛苦的表情……
0000000000000,千奈,わたくし……はじめて見ましたわ……,我……还是第一次见到哇……
0000000000000,広,わたしたちと別メニューの、\n激しいフィジカルトレーニング……,那可是和我们有着天壤之别的，\n极端的体能训练计划……
0000000000000,千奈,見ているだけで気が遠くなって\nしまいますわぁ……,光是看着就感觉要\n晕过去了呢……
0000000000000,佑芽,望むところだよ！　\nせっかく来たんだもん。,正合我意！\n难得来一趟嘛。
0000000000000,佑芽,ここでしかできない特訓を、\nたっぷりやっておかなくちゃ！,必须得好好做一做\n只有在这里才能进行的特训才行！
0000000000000,広,気を付けて、ね。油断するとマシンに\n殺されちゃう、かも。,要小心哦。一不留神可能会\n被器械干掉，也说不定。
0000000000000,広,さっき、わたしもあぶなかった。\n千奈とトレーナーに叱られた。,刚才，我就差点出事。\n被千奈和教练教训了。
0000000000000,千奈,心臓が飛び出るかと思いましたわ！！　\n気を付けてくださいませ！！,吓得我差点心脏都要跳出来了哇！！\n请千万要小心！！
0000000000000,広,うん……だけど、溢れるやる気は\n止められない。千奈も同じはず。,嗯……但是，满溢的干劲是\n压抑不了的。千奈应该也明白吧。
0000000000000,千奈,もちろんですわ！　プロデューサーは、\nこうおっしゃいました。,当然哇！\n制作人之前也说过——
0000000000000,{user},この特訓では佑芽さんの長所である\nフィジカルをさらに強化していきます。,这次特训是为了进一步强化\n佑芽同学最大的长处——体能。
0000000000000,{user},他のアイドルには到底真似できない\nような、アクロバティックなダンスを\n身につけましょう。,努力掌握其他偶像\n绝对无法模仿的\n如同特技般的舞蹈吧。
0000000000000,千奈,その片鱗を、毎日、見せつけられて\nいるのですもの……,每天，都能让我们见识到\n那惊人的舞蹈……
0000000000000,広,触発されないわけがない、ね。,不可能不被勾起兴趣，对吧。
0000000000000,佑芽,えへへ……これはね、\n『見取り稽古』の続きなんだって。,诶嘿嘿……这个呢，\n据说是『见习模仿』的延续哦。
0000000000000,佑芽,トップアイドルとあたしの間には、\nまだまだ埋められない技術の差がある。,顶级偶像和我之间，\n还存在着难以填补的技术差距。
0000000000000,佑芽,そういう、\nあたしが<em\=>まだ</em>真似できない部分を――,所以呢，我要把那些\n现在还模仿不了的部分——
0000000000000,佑芽,フィジカルごり押しで<em\=>置き換え</em>よう！　\nそれで似たようなことはできるはず！,靠体能来强行弥补掉！\n这样应该就能做到类似的效果了！
0000000000000,佑芽,――という試みなのだぁ！,——就是这样的尝试啦！
0000000000000,広,とっても頭悪いプランで好き。,看来笨也有笨的可爱呢。
0000000000000,千奈,花海さんらしいですわ～～～♪,很有花海同学的风格哇～～～♪
0000000000000,佑芽,ありがとー！　……褒めてるんだよね？,谢谢！……这是在夸我吧？
0000000000000,一同,はいっ！,当然！
0000000000000,佑芽,ならばよし。合宿を経て、\n理想のあたしに近づくぞ～！,那就好。通过这次集训，\n我要向理想中的自己迈进～！
0000000000000,佑芽,圧倒的な数値で、\n勝つべくして勝つためにッ！,为了以压倒性的数值，\n赢得理所应当的胜利！
0000000000000,佑芽,――けどね。これだけじゃ……\nコンペには勝てないと思うんだ。,——但是啊。光是这样……\n我觉得是赢不了竞赛的。
0000000000000,佑芽,アイドルとしての数値を\n伸ばすだけじゃ……,仅仅提升作为\n偶像的数值……
0000000000000,佑芽,冬の『H.I.F』でも、\n勝てないと思うんだ。,在冬天的『H.I.F』上，\n也是赢不了的。
0000000000000,広,ふふ、じゃあ、どうする、の？,呵呵，那么，你打算怎么办呢？
0000000000000,佑芽,倉本千奈と篠澤広の『見取り稽古』を\nはじめまーす！,仓本千奈和筱泽广的『见习模仿』\n现在开始——！
0000000000000,佑芽,言ったよね。ふたりの素敵なところを\n見習うって。実際、このままだと……,我说过的吧。要学习你们俩优秀的地方。\n而且，照现在这样下去……
0000000000000,佑芽,コンペで勝つのは……プロアイドルの\n先輩方の誰かか……,能在竞赛中获胜的……\n要么是某个偶像前辈……
0000000000000,佑芽,千奈ちゃんだと思う。,要么就是小千奈了。
0000000000000,千奈,ええぇっ……！？,诶诶诶……！？
0000000000000,広,千奈、佑芽の見立ては正しい。,千奈、佑芽的判断是正确的。
0000000000000,広,コンペ参加者の中で、タレントとして\n実力が一番上なのは倉本千奈。,在所有参赛者中，最有艺人才能的\n就是仓本千奈。
0000000000000,広,コンペのルールは、ひとりずつフリー\nパフォーマンスをするというもの。\nもちろん全員ライブをするはずだけど。,竞赛的规则是，\n每个人依次进行自由表演。\n当然，所有人都会选演出这条路。
0000000000000,広,視聴者投票で有利なのは千奈。\n今回の条件なら、プロアイドルと同等。,但在观众投票中占优势的是千奈。\n仅看这次，她与职业偶像不相上下。
0000000000000,広,佑芽のプロデューサーが協力してる\n佑芽のパパも有力。,得到佑芽制作人辅佐的\n佑芽爸爸也是强敌。
0000000000000,広,わたしと佑芽は……ふふ、敗色濃厚。,我和佑芽……呵呵，败局已定。
0000000000000,佑芽,だよねぇ～～～～～～～！,就是说啊～～～～～～～！
0000000000000,千奈,おふたりとも！　そんなにプレッシャー\nをかけないでくださいませぇ！,二位！请不要给我\n施加那么大的压力啊！
0000000000000,佑芽,――ほんとのことだよ。,——说的都是事实哦。
0000000000000,佑芽,千奈ちゃんも、広ちゃんも、あたしを\nたくさん褒めてくれるけど。,小千奈和小广\n虽然都对我赞不绝口。
0000000000000,佑芽,きっと……ほんの一歩だけ、\n早かっただけなんだよ。,但是……我一定只是\n快了那么一小步而已。
0000000000000,佑芽,あたしたち3人、\n学園の最底辺からはじまって。,我们三个人，\n都是从学院的最底层开始的。
0000000000000,佑芽,スタートで出遅れて……\n落ちこぼれの補習組なんて呼ばれてた。,起步就落后了……\n才被叫做吊车尾的补习组。
0000000000000,佑芽,あれから季節が巡って、夏が終わって。,从那以后季节流转，夏天结束了。
0000000000000,佑芽,あたし……ようやく、\nアイドルになったよ。,我……现在才终于，\n成为偶像了哦。
0000000000000,広,わたしも。,我也是。
0000000000000,千奈,わたくしも……,我也一样……
0000000000000,千奈,遅ればせながら、アイドルとして……\nスタートラインに立ちましたわ。,虽然起步很晚，但作为偶像……\n我也站上起跑线了哇。
0000000000000,佑芽,ほら、いつの間にか……\nまた、並んでる。,看吧，不知不觉间……\n我们又并排站在一起了。
0000000000000,佑芽,だからさぁっ！　やろうよ！　いままで\nあたしたちができなかったこと！,所以说啦！来放手一搏吧！\n一起挑战之前都无能为力的事吧！
0000000000000,佑芽,最初からアイドルだったみんなが、\n当たり前にやってたこと！,一起挑战一直在当偶像的大家\n早已习以为常的事吧！
0000000000000,佑芽,アイドルの話、たくさんしよう！　\n他の誰かの話じゃなくて――,一起来多聊聊偶像吧！\n不是聊其他什么人——
0000000000000,佑芽,立派なアイドルになった倉本千奈と、\n篠澤広と、花海佑芽の話を！,而是聊成为出色偶像的\n仓本千奈、筱泽广还有花海佑芽！
0000000000000,広,<r\=レビュー>批評</r>し合おう、って、こと？,意思是……相互点评指正吗？
0000000000000,千奈,先をゆく皆さまが……\nやっていたように？,就像早已起步的大家……\n一直在做的那样？
0000000000000,佑芽,うんっ！　コツを教え合って、長所を\n伸ばし合って、短所を潰し合って。\n自分たちの経験と意見を交換して――,嗯！互相传授诀窍、\n取长补短、弥补缺点。\n交换彼此的经验与意见——
0000000000000,佑芽,それが<r\=けんさん>研鑽</r>だよねっ！,这就是钻研吧！
0000000000000,広,ふふ……ほんとうに、いまさら。\nわたしたち……,呵呵……还真是，事到如今。\n我们……
0000000000000,千奈,……そんな当たり前のことですら、\nできてはいなかったんですのね。,……就连那种理所当然的事，\n都没能做到呢。
0000000000000,一同,やろう！！！,试试看吧！！！
0000000000000,佑芽,最後に勝つのは、あたしだけどね！,不过最后赢的，仍然会是我哦！
0000000000000,花海社長,咲季と離れ離れなのに……こんなに\n楽しそうな佑芽は、初めて見るな。,我还是头一次见……\n没有咲季在身边的佑芽这么开心。
0000000000000,佑芽,――お父さん。ちょうどよかった！　\nアイドルの話しよう！　色々教えて♪,——爸爸。来得正好！\n来聊聊偶像吧！　多告诉我点♪
0000000000000,花海社長,勉強を始めて1年に満たない、\nにわか専門家でよければ。,事先说好，我也只是个\n开始学习还不到一年的半吊子专家哦。
0000000000000,佑芽,上の世代のひとたちにとっては、\nスーパーヒーローだったって……\nいつも自慢してるじゃん。,爸爸不是老在自吹……\n自己在上一代人里\n可是超级英雄嘛。
0000000000000,佑芽,それってアイドルに通じるところが\nあると思うんだ。,这跟偶像也有\n相同之处吧。
0000000000000,花海社長,昔の話さ。若いつもりでいたけれど、\n君たちを見ていると……\n老いを実感せずにはいられないな。,都是过去的事了。\n我本以为自己还很年轻，\n但看到你们……人还是得服老啊。
0000000000000,花海社長,愛知の人々が言うように、\nいまの僕は、しょせん元アスリートの\nローカルタレントにすぎない……,爱知县的大伙儿说得也有道理，\n现在我不过是个前运动员\n还有地方艺人罢了……
0000000000000,花海社長,ちょっと顔がいいだけの……メシマズ\nアスレチックおじさんだよ……,只是脸有点帅……\n但做饭难吃的健身大叔而已……
0000000000000,佑芽,ついにエゴサーチしちゃったの……？　\nみんなで内緒にしてたのに！,你终于还是去自搜了……？\n明明大家那么努力瞒着你！
0000000000000,花海社長,ハァ～、もう今夜はネガティブな話しか\nできそうにない……ハァ～。,唉～，看来今晚能说的只剩丧气话了……\n唉～。
0000000000000,佑芽,じゃあ……代わりに……\nずっと聞けなかった話、するよ。,那么……你不说的话……就让我来\n问一个一直没能说出口的问题吧。
0000000000000,佑芽,あたし……お父さんやお母さんの期待、\n裏切っちゃった？,我……是不是辜负了\n爸爸妈妈的期待？
0000000000000,佑芽,本当は……アイドルじゃない方が、\nよかった？,是不是……不当偶像的话\n会更好呢？
0000000000000,花海社長,ばかだな。\n最初から期待なんてしてない。,傻瓜。\n我一开始就没抱什么期待。
0000000000000,佑芽,ええぇぇえ！？,诶诶诶诶诶！？
0000000000000,花海社長,僕が期待するのは自分自身。それと、\n利害が一致している仲間に対してだけ。,我只会对自己，\n以及和自己利害一致的伙伴抱有期待。
0000000000000,花海社長,佑芽と咲季のことは、<em\=>応援</em>してる。,至于对佑芽和咲季，我只有支持这一种态度。
0000000000000,佑芽,これからは……期待して、いいよ。\nあたしはアイドルだから。,那以后……你可以试着，期待一下我哦。\n因为我是偶像啊。
0000000000000,佑芽,みんなの期待に応えるのが仕事！！！,回应大家的期待就是我的工作！！！
0000000000000,花海社長,ハハ、じゃあ、そうだなあ――,哈哈，那么，说得也是啊——
0000000000000,花海社長,元スーパーヒーローからいわせて\nもらえば、後悔のない引退なんてない。,让我这个前超级英雄来说的话，\n不存在毫无遗憾的引退。
0000000000000,花海社長,道中、思いっきり暴れなさい。\n夢が終わるとき、\n良い挑戦だったって強がれるように。,在这条路上，尽情地大闹一场吧。\n为了在梦想终结时，\n也要逞能说，真是场过瘾的对决。
0000000000000,佑芽,はいっ！,是！
0000000000000,花海社長,敵を大切に。抜いたり抜き返されたりを\n楽しみなさい。,要珍视你的对手。\n享受你追我赶的过程吧。
0000000000000,佑芽,はいっ！　……期待じゃなくない？　\n――まあいっかあ！,是！　……这好像不是期待吧？\n——算了不管啦！
0000000000000,佑芽,コンペではお父さんも敵だからねっ！\nよぉぉ～～～～～っし！,在竞赛里爸爸也是敌人哦！\n好～～～～～嘞！
0000000000000,佑芽,思いっきり暴れて――\n粉々にしてやるぞぉ！！,我要尽情大闹一场——\n把你们都揍扁！！
info,adv_dear_hume_026.txt,,
译者,煉金術式,,
