id,name,text,trans
0000000000000,{user},雨夜さん、お疲れ様です。\n素晴らしいライブでしたね。,雨夜同学，辛苦了。\n演出非常精彩。
0000000000000,燕,フッ、当然だ。,哼，那是当然的。
0000000000000,燕,それよりも、\n『N.I.A』の状況はどうなっている？,比起这个，\n『N.I.A』的现状如何了？
0000000000000,{user},ファン投票の順位ですが、\n雨夜さんと白草月花さんを除けば――,粉丝投票的排名方面，\n除去雨夜同学和白草月花同学的话——
0000000000000,{user},秦谷さん、倉本さんが\nどんどん順位を上げています。,秦谷同学和仓本同学的排名\n也正在飞速上升。
0000000000000,燕,ほう、素晴らしいな。\n花海はどうだ？,嚯，干得不错嘛。\n花海那边呢？
0000000000000,{user},花海さんも順位は伸ばしていますが、\n白草四音さんに負けたので……,花海同学的排名虽然也在上升，\n但毕竟输给了白草四音……
0000000000000,{user},『FINALE』出場は難しいかと。,恐怕很难在『FINALE』登场了。
0000000000000,燕,……そうか。\nそれでも順位が伸びれば、あるいは――,……是吗。\n要是她排名能再冲一冲，或许——
0000000000000,燕,初星の生徒会3人の優勝争いが\n実現するやも、と思ったのだがな……,我本来还指望能看到\n初星学生会三人会师决赛的场面呢……
0000000000000,{user},白草四音さんには、賀陽さんの\n手助けがあるようです。,白草四音那边，\n似乎有贺阳同学在帮忙。
0000000000000,{user},雨夜さんに負けて勢いが落ちたものの、\n『FINALE』出場は固い。,虽说败给雨夜同学后势头受挫，\n但晋级『FINALE』应该是板上钉钉了。
0000000000000,燕,つまり、『FINALE』は秦谷、倉本、\n白草四音の3人で優勝を争うのか？,也就是说，『FINALE』将由秦谷、仓本、\n以及白草四音3人来争夺冠军吗？
0000000000000,{user},俺の分析では、その可能性が高いです。,根据我的分析，这种可能性很高。
0000000000000,{user},その後、雨夜さんと白草月花さんの\n一騎打ちが行われます。,紧接着，就是雨夜同学和白草月花同学的\n一对一决斗。
0000000000000,燕,ふむ。私が勝つのは前提として――,嗯。我能赢是前提——
0000000000000,燕,極月との戦いという視点では、\n初星のどちらかが優勝すればいい。,从对抗极月学园的角度来看，\n初星这边谁夺冠都无所谓。
0000000000000,燕,とはいえ、\n秦谷を指導してきた身としては――,话虽如此，\n身为指导过秦谷的人——
0000000000000,燕,――やはり、秦谷に優勝してほしいな。,——我果然还是希望秦谷能赢啊。
0000000000000,美鈴,まあ……ふふ、ありがとうございます。,哎呀……呵呵，谢您吉言。
0000000000000,燕,うむ。期待しているぞ。,嗯。我很期待哦。
0000000000000,燕,なぜ貴様がここにいる！？,……等等，你怎么在这里！？
0000000000000,{user},雨夜さんに用があるとお聞きしたので、\n楽屋に入れておきました。,听说她有事找雨夜同学，\n我就让她进后台了。
0000000000000,燕,勝手に入れるなァ！！,别擅自把人放进来啊！！
0000000000000,美鈴,……燕先輩。先ほどのライブ、\n感服いたしました。,……燕前辈。刚才的演出，\n实在是令人感佩。
0000000000000,燕,ど、どうした？\n急に殊勝な態度を取りおって……,怎、怎么了？\n突然摆出这副乖巧的态度是想干嘛……
0000000000000,美鈴,燕先輩のご指導のおかげで、\nりんちゃんに勝てました。,多亏了燕前辈的指导，\n我才能赢过小燐。
0000000000000,美鈴,勝って……仲直りできました。,赢了她……也和她重归于好了。
0000000000000,美鈴,だから、恩返しのために、\n『N.I.A』は優勝しておきますね。,所以，为了报恩，\n我会拿下『N.I.A』的优胜。
0000000000000,美鈴,それが初星の生徒会としての義務\n……そう仰っていましたから。,这也是作为初星学生会的义务\n……您是这么说过的吧。
0000000000000,燕,その勝って当然という顔、\n……相変わらずだな。,你那副胜券在握的表情，\n……真是一点没变啊。
0000000000000,燕,初星学園の実力を見せつけるついでに、\n星南が指導した倉本にも勝利してこい！,既然要展示初星学园的实力，\n那就顺便把星南指导的仓本也赢下来！
0000000000000,美鈴,分かりました。,明白了。
0000000000000,美鈴,……そして、燕先輩の\nプロデューサーも、,……还有，燕前辈的\n制作人也是，
0000000000000,美鈴,担当アイドルではないわたしに……\nアドバイスをしていただきました。,明明我不是您负责的偶像……\n您却还是给了我建议。
0000000000000,{user},それも、雨夜さんのプロデュースの\n一環ですから。,毕竟这也是雨夜同学\n培育计划的一环。
0000000000000,美鈴,もし……あなたが、わたしのもの\nだったなら、と少し思いましたが――,我稍微想过，如果……\n您属于我就好了——
0000000000000,燕,――秦谷。いくらお前でも、\nそれだけは認めんぞ。,――秦谷。唯独这个，\n就算是你我也绝不答应。
0000000000000,燕,コレは、私のモノだ。,这个家伙，是我的东西。
0000000000000,美鈴,ふふっ……そうでしょうね。,呵呵……也是呢。
0000000000000,{user},（さっきから、物扱いされている……）,（从刚才开始就一直被当成物品……）
0000000000000,美鈴,では、燕先輩も、一騎打ち……\n頑張ってください。,那么，燕前辈，一对一决斗……\n请您加油。
0000000000000,燕,フッ、任せておけ。\n私は戦いの中で成長している。,哼，包在我身上。\n战斗只会让我变得更强。
0000000000000,燕,今の私なら、勝ち目はあるはずだ。,若是现在的我，应当有一战之力。
0000000000000,{user},同意見です。,我也同意。
0000000000000,{user},白草月花の実力は群を抜いている。\n紛れもなくトップアイドルのひとり。,白草月花的实力出类拔萃。\n是毫无疑问的顶级偶像之一。
0000000000000,{user},それに対して、雨夜さんの実力は\nいまだトップアイドルには及ばない。,相比之下，雨夜同学的实力\n目前还不及顶级偶像。
0000000000000,美鈴,……まあ。\nでは、どうして勝ち目があると？,……哎呀。\n既然如此，胜算又从何而来？
0000000000000,{user},――相手が、格上だからです。,――正因为对手已是骄兵。
0000000000000,燕,クックック……\n貴様の言う通りだ、プロデューサー。,哼哼哼……\n制作人，你这家伙说的不错啊。
0000000000000,燕,月を砕くための牙は磨いた。\nなら、後は挑むだけだ。,碎月的獠牙已经磨好了。\n那么，剩下的就是挑战了。
0000000000000,{user},では、白草月花を倒すための\nミーティングを始めましょうか。,那么，开始制定击溃\n白草月花的战术吧。
0000000000000,燕,ああ、血が滾ってきたぞ……！\nよろしく頼む！,啊啊，我的血开始躁动了……！\n拜托你了！
info,adv_dear_atbm_017.txt,,
译者,病毒,,
