id,name,text,trans
0000000000000,星南,さて……花海咲季さん。どうかしら？,那么……花海咲季同学。怎么样呢？
0000000000000,星南,私が佑芽のプロデュースをすることを、\n認めてくれる？,由我来培育佑芽这件事，\n你认可了吗？
0000000000000,咲季,そんなにすぐ答えなんて出せないわ。,我可没办法这么快给出答案哦。
0000000000000,咲季,あなたの仕事ぶりを、ほんのすこし\n垣間見ただけだもの。,我只是稍微瞥见了一下\n你的工作方式而已。
0000000000000,星南,それもそうね。ただ……\nいますぐ止めるつもりはない。\nそういう理解でいい？,那倒也是呢。只是……\n“没有打算让我马上停止”\n这样理解可以吗？
0000000000000,咲季,ええ。プロデューサーとしての実力は、\nまだわからないけれど。,嗯。你作为制作人的实力，\n我还不太清楚。
0000000000000,咲季,素敵な生徒会長だってことは、\n伝わってきたもの。,但你是个出色的学生会长这一点，\n我已经感受到了。
0000000000000,咲季,これこそが、\nわたしが期待<em\=>していた</em>十王星南。\nそう思った。,这样才是，\n“我所期待的十王星南”\n我是这样认为的。
0000000000000,星南,含みのある台詞。,意味深长的话语呢。
0000000000000,星南,まるで私が、あなたを失望させたことが\nあるような口ぶりじゃない。,听起来就好像我曾经\n让你失望过似的。
0000000000000,咲季,心当たりがあるでしょ？,你心里有数吧？
0000000000000,星南,あるわね。フフ……謝らないけど。,有呢。呵呵……但我不会道歉的。
0000000000000,咲季,結構よ。こっちだって、尊敬<em\=>していた</em>\n『<r\=プリマステラ>一番星</r>』に向かって……\n無礼なことを言ったもの。,没关系哦。我这边也对\n我所尊敬的『启明星』……\n说了些无礼的话。
0000000000000,星南,そう、ね――……,是呢――……
0000000000000,星南,ありがとう、花海咲季さん。,谢谢你，花海咲季同学。
0000000000000,咲季,なんでお礼を言われたのか、\nさっぱりわからないわ。,为什么你要向我道谢，\n我是完全不明白呢。
0000000000000,星南,忘れたの？　\n私に見せてくれるんでしょう？,你忘了吗？\n你不是要让我看看吗？
0000000000000,星南,限界を超えるお手本を。,成为超越极限的榜样。
0000000000000,咲季,もちろん覚えているわ、<em\=>先輩</em>。,我当然记得，前辈。
0000000000000,咲季,この後輩に、任せなさいっ！,就交给我这个后辈吧！
info,adv_csprt-3-0089_03.txt,,
译者,pm,,
